{
  "$schema": "https://json-schema.org/draft/2020-12/schema",
  "$id": "https://github.com/21g-bot/life-mind/schemas/capability-manifest.schema.json",
  "title": "LIFE-Mind Capability Manifest 0.1",
  "type": "object",
  "additionalProperties": false,
  "required": ["schemaVersion", "id", "version", "name", "permissions", "rateLimits"],
  "properties": {
    "schemaVersion": {"const": "0.1"},
    "id": {
      "type": "string",
      "pattern": "^[a-z0-9]+(?:[._-][a-z0-9]+)*$"
    },
    "version": {
      "type": "string",
      "pattern": "^[0-9]+\\.[0-9]+(?:\\.[0-9]+)?(?:[-+][a-zA-Z0-9.-]+)?$"
    },
    "name": {"type": "string", "minLength": 1},
    "permissions": {
      "type": "array",
      "minItems": 1,
      "uniqueItems": true,
      "items": {
        "type": "string",
        "pattern": "^(observe|memory|action|share|network|device|ui):[^:]+$"
      }
    },
    "forbidden": {"$ref": "#/$defs/uniqueStrings"},
    "dataScopes": {"$ref": "#/$defs/uniqueStrings"},
    "networkAllowlist": {
      "type": "array",
      "uniqueItems": true,
      "items": {
        "type": "string",
        "pattern": "^(?:[a-zA-Z0-9](?:[a-zA-Z0-9-]{0,61}[a-zA-Z0-9])?\\.)*[a-zA-Z0-9](?:[a-zA-Z0-9-]{0,61}[a-zA-Z0-9])?$"
      }
    },
    "rateLimits": {
      "type": "object",
      "minProperties": 1,
      "additionalProperties": {"type": "integer", "minimum": 1}
    }
  },
  "$defs": {
    "uniqueStrings": {
      "type": "array",
      "items": {"type": "string", "minLength": 1},
      "uniqueItems": true
    }
  }
}
